{
    "$schema": "http://json-schema.org/draft-04/schema#",
    "title": "Customer success",
    "description": "Customer success teaser",
    "category": "component",
    "type": "object",
    "format": "grid",
    "properties": {
        "name": {
            "type": "string",
            "enum": [ "customer_success" ],
            "options": {
                "hidden": true
            }
        },
        "template": {
            "type": "string",
            "options": {
                "hidden": true
            }
        },
        "misc_data": {
            "type": "string",
            "options": {
                "hidden": true
            }
        },
        "logo": {
            "title": "Logo",
            "$ref": "image.json"
        },
        "image": {
            "title": "Photo",
            "$ref": "image.json"
        },
        "title": {
            "title": "Headline",
            "type": "string"
        },
        "summary": {
            "title": "Summary",
            "type": "string",
            "format": "textarea"
        },
        "link": {
            "$ref": "link.json"
        }
    },
    "required": [ "title", "summary", "link", "logo", "image", "name" ],
    "additionalProperties": false
}
